"Season","Sector","Category","Crop","QueryType","QueryText","KccAns","StateName","DistrictName","BlockName","CreatedOn"
"NA","ANIMAL HUSBANDRY","Animal","Bovine(Cow,Buffalo)","Dairy Production","Animal poruction (GOAT PRODUCTION )  ?","KISAN BHAI AAP BAKRI PALAN KE LIYE  18001805141","UTTAR PRADESH","KANPUR DEHAT","DERAPUR","2019-01-23T19:06:24.44"
"NA","ANIMAL HUSBANDRY","Animal","Bovine(Cow,Buffalo)","Dairy Production","Animal poruction (GOAT PRODUCTION )  ?","KISAN BHAI AAP BAKRI PALAN KE LIYE  18001805141","UTTAR PRADESH","KANPUR DEHAT","DERAPUR","2019-01-23T19:06:24.44"
"NA","ANIMAL HUSBANDRY","Animal","Bovine(Cow,Buffalo)","Dairy Production","Animal poruction (GOAT PRODUCTION )  ?","KISAN BHAI AAP BAKRI PALAN KE LIYE  18001805141","UTTAR PRADESH","KANPUR DEHAT","DERAPUR","2019-01-23T19:06:24.44"
"NA","ANIMAL HUSBANDRY","Animal","Bovine(Cow,Buffalo)","Dairy Production","Animal poruction (GOAT PRODUCTION )  ?","KISAN BHAI AAP BAKRI PALAN KE LIYE  18001805141","UTTAR PRADESH","KANPUR DEHAT","DERAPUR","2019-01-23T19:06:24.44"
"NA","ANIMAL HUSBANDRY","Animal","Bovine(Cow,Buffalo)","Dairy Production","Animal poruction (GOAT PRODUCTION )  ?","KISAN BHAI AAP BAKRI PALAN KE LIYE  18001805141","UTTAR PRADESH","KANPUR DEHAT","DERAPUR","2019-01-23T19:06:24.627"
"NA","ANIMAL HUSBANDRY","Animal","Bovine(Cow,Buffalo)","Dairy Production","Animal poruction (GOAT PRODUCTION )  ?","KISAN BHAI AAP BAKRI PALAN KE LIYE  18001805141","UTTAR PRADESH","KANPUR DEHAT","DERAPUR","2019-01-23T19:06:24.64"
"NA","ANIMAL HUSBANDRY","Animal","Bovine(Cow,Buffalo)","Dairy Production","Animal poruction (GOAT PRODUCTION )  ?","KISAN BHAI AAP BAKRI PALAN KE LIYE  18001805141","UTTAR PRADESH","KANPUR DEHAT","DERAPUR","2019-01-23T19:06:24.657"
"NA","AGRICULTURE","Others","Others","Weather","Asking about weather information of District Kanpur dehat.....?
","kisan bhai aapke yaha 25 january ko tej baaris ki sambhawna bni hui hai.
","UTTAR PRADESH","KANPUR DEHAT","SARBANKHERA","2019-01-23T19:14:01.98"
"NA","AGRICULTURE","Others","Others","Weather","WEATHER INFORMATION ABOUT DISTRICT-…….?","KISAN BHAI AAPKE YAHA PAR 23 SE 27 JANUARY TAK GHANE BAADAL RAHENGE AUR 25 JANUARY KO BAARIS HONE KI SAMBHAVANA HAI. ","UTTAR PRADESH","KANPUR DEHAT","AKBARPUR","2019-01-23T19:26:38.22"
"NA","AGRICULTURE","Others","Others","Weather","WEATHER INFORMATION ABOUT DISTRICT-KANPUR DEHAT…….?","KISAN BHAI AAPKE YAHA PAR 23 SE 27 JANUARY TAK GHANE BAADAL RAHENGE AUR 25 JANUARY KO BAARIS HONE KI SAMBHAVANA HAI. ","UTTAR PRADESH","KANPUR DEHAT","AKBARPUR","2019-01-23T19:27:01.727"
"NA","AGRICULTURE","Others","Others","Weather","weathar info of agra","kisan bhai 25 aur 26 janvary me hlki se tej baarish ki sambhavna hai .
","UTTAR PRADESH","KANPUR DEHAT","MALASA","2019-01-23T20:21:16.863"
"NA","AGRICULTURE","Others","Others","Weather","Tell me about weather information in district Kanpur Dehat?","Farmer brother there is a possibility of rain in this week on 25 January.
","UTTAR PRADESH","KANPUR DEHAT","JHINJHAK","2019-01-23T21:07:59.92"
"NA","AGRICULTURE","Others","Others","Weather"," Please give me weather information in district kanpur dehat….?","Farmer brother will remain cloudy every day from January 24 to January 29 and you are likely to get drizzle on 24 January and moderate rains on January 25.
","UTTAR PRADESH","KANPUR DEHAT","JHINJHAK","2019-01-24T07:02:26.44"
"NA","AGRICULTURE","Others","Others","Weather","Weather infornmation about 
","kisan bhai apke yaha 25 Janvary ko bundabandi hone ki sambhavna hai .
","UTTAR PRADESH","KANPUR DEHAT","AMRODHA","2019-01-24T07:18:51.097"
"NA","AGRICULTURE","Others","Others","Weather","Please give me weather information of akbarpur in the kanpur dehat...........?
"," Kisan Bhai, according to your area there is a possibility of light rainfall on 25 January
","UTTAR PRADESH","KANPUR DEHAT","AKBARPUR","2019-01-24T07:25:51.993"
"NA","AGRICULTURE","Others","Others","Weather","Information of weather in District Kanpur Dehat...?","kisan bhai 24 janwari ko mausam saf rahega   25 janwari -26 janwari ko barish hone ki sambhavana hai baki din 27 janwari se 29 janwari tak mausm saf rahega 
","UTTAR PRADESH","KANPUR DEHAT","SARBANKHERA","2019-01-24T07:34:46.38"
"NA","AGRICULTURE","Others","Others","Weather","Please give me weather information of rasulabad in the kanpur dehat............?
"," Kisan Bhai, according to your area there is a possibility of light rainfall on 25 January
","UTTAR PRADESH","KANPUR DEHAT","RASULABAD","2019-01-24T07:44:31.03"
"NA","AGRICULTURE","Others","Others","Weather","Plz give me weather information ?
","Kisan Bhai, there is a possibility of light rain on January 24-25 in your district, the weather will remain clear till 26-29.
","UTTAR PRADESH","KANPUR DEHAT","RASULABAD","2019-01-24T07:48:37.733"
"NA","AGRICULTURE","Others","Others","Weather","Tell me about Weather Information of this week at Kanpur Dehat District?","Kisan bhai 24 se 29 January tak apke shetra me badal chaye rahenge,25 january ko halki barish hone ki sambhavna hai.","UTTAR PRADESH","KANPUR DEHAT","JHINJHAK","2019-01-24T08:20:10.14"
"NA","AGRICULTURE","Others","Others","Weather","Please give me weather information of sikandra in kanpur dehat............?
"," Kisan Bhai, according to your area there is a possibility of light rainfall on 25 January
","UTTAR PRADESH","KANPUR DEHAT","RAJPUR","2019-01-24T08:37:54.903"
"NA","AGRICULTURE","Others","Others","Weather","Information about weather report in Dist. Kanpue Dehat (Rasulabad)  .......?
","kisaan bhai 25 se 27 january tak aapke yaha halki baarish hone ki sambhavna hai. Badal bane rahenge. 
","UTTAR PRADESH","KANPUR DEHAT","RASULABAD","2019-01-24T08:50:36.307"
"NA","AGRICULTURE","Others","Others","Weather","Information about weather report in Dist. Kanpur Dehat (Rasulabad)  .......?
","kisaan bhai 25 se 27 january tak aapke yaha halki baarish hone ki sambhavna hai. Badal bane rahenge. 
","UTTAR PRADESH","KANPUR DEHAT","RASULABAD","2019-01-24T08:51:00.3"
"NA","AGRICULTURE","Others","Others","Weather","Give me weather information in district Kanpur Dehat  ?
","kisan bhai aapke yaha kal hlki bundaa baandi hone ki sambhavana bni hui hai baaki 29 january tak baarish hone ki koi sambhavana nahi hai  
","UTTAR PRADESH","KANPUR DEHAT","SARBANKHERA","2019-01-24T09:19:58.87"
"NA","AGRICULTURE","Others","Others","Weather","kanpur dehat Zile ki mausam ki jankari bataye
","kisan bhai aap ke yaha 25,26 january me halki barish hone ki sambhawana bani hai  
","UTTAR PRADESH","KANPUR DEHAT","MAITHA","2019-01-24T09:29:18.373"
"NA","AGRICULTURE","Others","Others","Weather","Weather information of Kanpur Dehat district....?","Kisan Bhai, this week, there is a possibility of light rains on January 25","UTTAR PRADESH","KANPUR DEHAT","SANDALPUR","2019-01-24T09:32:20.96"
"NA","AGRICULTURE","Others","Others","Weather","Please give me weather information for block-MAITHA,district-KANPUR DEHAT?
","There is a possibility of rain on 25-26 January from the farmer's brother. Clouds will remain.
","UTTAR PRADESH","KANPUR DEHAT","MAITHA","2019-01-24T09:51:33.243"
"NA","AGRICULTURE","Others","Others","Weather","Please give me weather information kanpur dehat …?
","Kisan bhai aap ke yaha aaj se 29 januwari tak beech beech me baadal hai aur 25   januwari ko 6-8  mm tak barish ki sambhavana hai 
","UTTAR PRADESH","KANPUR DEHAT","AMRODHA","2019-01-24T09:54:03.787"
"NA","AGRICULTURE","Others","Others","Weather","Weather infornmation about Kanpur Dehat ?
","kisan bhai apke yaha 25 Janvary ko barish hone ki sambhavna hai .
","UTTAR PRADESH","KANPUR DEHAT","SANDALPUR","2019-01-24T10:02:12.87"
"NA","AGRICULTURE","Others","Others","Weather","Tell me about  weather information in malasa
","Kisan Bhai, you will remain cloudy from 25th January to 26th January and there is a possibility of light rain.
","UTTAR PRADESH","KANPUR DEHAT","MALASA","2019-01-24T10:21:43.28"
"NA","AGRICULTURE","Others","Others","Weather","Tell me about Weather Information of this week at Kanpur Dehat District?","Kisan bhai 24 se 29 January tak apke shetra me badal chaye rahenge,25 january ko halki barish hone ki sambhavna hai.","UTTAR PRADESH","KANPUR DEHAT","RASULABAD","2019-01-24T10:28:03.147"
"NA","AGRICULTURE","Others","Others","Weather","Weather information of Kanpur dehat......?","Kisan bhai aapke yaha 25 January ke din 04 mm barish hone ki sambhavana hai 


","UTTAR PRADESH","KANPUR DEHAT","RASULABAD","2019-01-24T10:52:12.443"
"NA","AGRICULTURE","0","0","Weather","please give weather information for kanpur dehat?","Kisan Bhai in your block is cloudy on 25th January and there is a possibility of rain","UTTAR PRADESH","KANPUR DEHAT","SANDALPUR","2019-01-24T11:01:50.777"
"NA","AGRICULTURE","Others","Others","Weather","Tell me about Weather Information of this week at Kanpur Dehat District?","Kisan bhai 24 se 29 January tak apke shetra me badal chaye rahenge,25 january ko halki bunda bandi hone ki sambhavna hai.","UTTAR PRADESH","KANPUR DEHAT","JHINJHAK","2019-01-24T11:02:20.683"
"NA","AGRICULTURE","Others","Others","Weather","Plz give me weather information ?
","Kisan Bhai, there is a possibility of light rain on January 24-25 in your district, the weather will remain clear till 26-29.
","UTTAR PRADESH","KANPUR DEHAT","RASULABAD","2019-01-24T11:10:47.737"
"NA","AGRICULTURE","Others","Others","Weather","Tell me about Weather Information of this week at  Kanpur Dehat District?","Kisan bhai 24 se 29 January tak apke shetra me badal chaye rahenge,25 january ko barish hone ki sambhavna hai.","UTTAR PRADESH","KANPUR DEHAT","AMRODHA","2019-01-24T11:12:24.757"
"NA","AGRICULTURE","Others","Others","Weather","Weather Information District Kanpur dehat.....?","You are likely to get light showers on 24 to 26 January.","UTTAR PRADESH","KANPUR DEHAT","SANDALPUR","2019-01-24T11:22:38.347"
"NA","HORTICULTURE","Condiments and Spices","Coriander","	Plant Protection	","Nilgai's problem is in the coriander crop","Kisan Bhai, you have given the name of Ruffucakkar medicine, 1 kg 10 to 12 kg of ash in the ash and shave the edge of the morning in the morning.","UTTAR PRADESH","KANPUR DEHAT","AMRODHA","2019-01-24T11:44:53.637"
"NA","AGRICULTURE","Cereals","Wheat","Cultural Practices","Weedicide effect in wheat crop?","Kisan bhai ap genhu me 15 gram urea aur 5 gram zinc sulphate prati litr panee ki dar se ghol banakar chhidkaw kare","UTTAR PRADESH","KANPUR DEHAT","RASULABAD","2019-01-24T12:34:11.54"
"NA","AGRICULTURE","Others","Others","Weather","Information about the weather in Kanpur dehat district ....?
","kisan bhai 25 janvary ko hlki baris avm 24,26,27,28,29 janvary  ko hlke badal bane rahne ki sambhavna hai.
","UTTAR PRADESH","KANPUR DEHAT","RASULABAD","2019-01-24T12:37:36.903"
"NA","AGRICULTURE","Others","Others","Weather","Weather Information District Kanpur Dehat....?","You can not expect rainfall from 26 to 29 January.","UTTAR PRADESH","KANPUR DEHAT","JHINJHAK","2019-01-24T12:46:06.61"
"NA","AGRICULTURE","Others","Others","Weather","WEATHER INFORMATION OF DISTRICT KANPUR DEHAT ?
","Kisan Bhai in your area from 24 January to 26 January will remain cloudy and there is possibility of rain and the weather will remain clear from Jan 27 to Jan 29 There is no possibility of rain","UTTAR PRADESH","KANPUR DEHAT","AMRODHA","2019-01-24T12:57:47.187"
"NA","AGRICULTURE","Cereals","Wheat","Weed Management","Weed control in the wheats crop….?","Metsulfuran Methyl 20% WG,8-9gm/acre 150 litar paani me ghol bnakar chhidkaw kijiye
","UTTAR PRADESH","KANPUR DEHAT","AKBARPUR","2019-01-24T13:06:44.18"
"NA","AGRICULTURE","Others","Others","Weather","Weather information in jhinjhak..?
","Farmer brother, there is a possibility of rain on January 25.
","UTTAR PRADESH","KANPUR DEHAT","JHINJHAK","2019-01-24T13:13:29.647"
"NA","AGRICULTURE","Others","Others","Weather","Give me about weather information in ......?
","kisan bhai ap ke yhan 25 January ko 3-5mm tak baris hone ki sambhavna hai
","UTTAR PRADESH","KANPUR DEHAT","DERAPUR","2019-01-24T13:38:49.94"
"NA","AGRICULTURE","Others","Others","Weather","Information about weather report in Dist. Kanpur Dehat  (Rajpur)  .......?
","kisaan bhai 24 se 26 january tak aapke yaha halki baarish hone ki sambhavna hai. Badal bane rahenge. 
","UTTAR PRADESH","KANPUR DEHAT","RAJPUR","2019-01-24T13:51:05.243"
"NA","AGRICULTURE","Others","Others","Weather","Weather information in kanpur dehat...?
","Farmer brother, there is a possibility of rain on January 25.
","UTTAR PRADESH","KANPUR DEHAT","DERAPUR","2019-01-24T13:57:24.097"
"NA","AGRICULTURE","Others","Others","Weather","weather information of malasa , kanpur dehat ?","kisan bhai aapke yhan 25 aur 26 january me halki barish hone ki sambhawana hai ","UTTAR PRADESH","KANPUR DEHAT","MALASA","2019-01-24T14:10:10.63"
"NA","AGRICULTURE","Others","Others","Weather","Please tell me Weather  information for rajpur in kanpur dehat district..?   ","Kisan bhai aapke yaha 25 January 2019 ko barish hone ki sambhavana hai","UTTAR PRADESH","KANPUR DEHAT","RAJPUR","2019-01-24T14:10:29.21"
"NA","AGRICULTURE","Others","Others","Weather","Weather information About   ....?",".
kisan bhai 25 janvary me hlki  baarish ki sambhavna hai .
","UTTAR PRADESH","KANPUR DEHAT","RASULABAD","2019-01-24T14:37:03.37"
"NA","AGRICULTURE","Others","Others","Weather"," Weather Information in Gajner ?","There is a possibility of rain on 24,25 January
","UTTAR PRADESH","KANPUR DEHAT","SARBANKHERA","2019-01-24T14:39:07.813"
"NA","AGRICULTURE","Others","Others","Weather","WEATHER INFORMATION OF DISTRICT KANPUR ...?
","Kisan Bhai, here you will be partially cloudy today from 24 January to 29 January. These clouds are likely to be a cause of storm surge.
","UTTAR PRADESH","KANPUR DEHAT","JHINJHAK","2019-01-24T14:51:38.64"
"NA","AGRICULTURE","Others","Others","Weather","weather information of sikandra , kanpur dehat ?","kisan bhai aapke yhan 25 aur 26 january me halki barish hone ki sambhawana hai ","UTTAR PRADESH","KANPUR DEHAT","SANDALPUR","2019-01-24T15:01:36.27"
"NA","AGRICULTURE","Others","Others","Weather","Weather information in kanpur dehat ..?","Farmer brother, are you likely to receive heavy rain this January 25
","UTTAR PRADESH","KANPUR DEHAT","SARBANKHERA","2019-01-24T15:10:33.853"
"NA","AGRICULTURE","Others","Others","Weather","about weather information in kanpur dehat…? 	     ","possibilty of light rain fall in 25 january 2019 in kanpur dehat","UTTAR PRADESH","KANPUR DEHAT","RASULABAD","2019-01-24T15:33:58.453"
"NA","AGRICULTURE","Others","Others","Weather","weather information of malasa , kanpur dehat ?","kisan bhai aapke yhan 25 aur 26 january me halki barish hone ki sambhawana hai ","UTTAR PRADESH","KANPUR DEHAT","MALASA","2019-01-24T15:40:26.15"
"NA","AGRICULTURE","Others","Others","Weather","Weather information in Kanpur Dehat distt..............?","apke block me 24 ,25 aur 26 January ke din baadal bne hai aur barish ki bhi sambhawana bni hui hai.","UTTAR PRADESH","KANPUR DEHAT","RASULABAD","2019-01-24T15:59:07.967"
"NA","AGRICULTURE","Others","Others","Weather","Information about weather condition at rasulabad block kanpur dehat district ? 
","Dear farmer there will be cloudy weather in your area and possibility of light precipitation at 24 January 2019 and rain at 25 January 2019 
","UTTAR PRADESH","KANPUR DEHAT","RASULABAD","2019-01-24T16:20:12.697"
"NA","ANIMAL HUSBANDRY","Animal","Bovine(Cow,Buffalo)","Cattle shed Planning and Management","pasu palan ki jankari?","kisan bhai-18001805141 pasuplaen vibhag me sampark kare","UTTAR PRADESH","KANPUR DEHAT","RASULABAD","2019-01-24T16:26:33.703"
"NA","AGRICULTURE","Others","Others","Weather","Weather information in kanpur dehat ..?","Farmer brother, are you likely to receive heavy rain this January 25
","UTTAR PRADESH","KANPUR DEHAT","RASULABAD","2019-01-24T16:34:02.74"
"NA","HORTICULTURE","Condiments and Spices","Garlic","Field Preparation","dhaniyan me mahun laga hai ?","dimathoate 30%ec 2 ml/liter paani ke sath spre kare","UTTAR PRADESH","KANPUR DEHAT","SANDALPUR","2019-01-24T16:53:22.17"
"NA","AGRICULTURE","Others","Others","Weather","Information about weather district  kanpur dehat   ...?
","Farmer brother, there is a possibility of rain on 25.
","UTTAR PRADESH","KANPUR DEHAT","DERAPUR","2019-01-24T16:55:34.35"
"NA","AGRICULTURE","Others","Others","Weather","Weather information in Derapur.........?
","Dear farmer, there is a possibility of rain on January 25.
","UTTAR PRADESH","KANPUR DEHAT","DERAPUR","2019-01-24T17:03:08.927"
"NA","AGRICULTURE","Others","Others","Weather","weather information of kanpur dehat  zila .........?","kisan bhai 25 junwari me halki barish ki sambhavna hai ","UTTAR PRADESH","KANPUR DEHAT","RASULABAD","2019-01-24T17:03:47.77"
"NA","AGRICULTURE","Others","Others","Weather","WEATHER INFORMATION. …..?","KISAN BHAI AP KE YAHA PAR IS SAPTAH 25-26 JANUARY KO BAARISH HONE KI SAMBHAVANA HAI","UTTAR PRADESH","KANPUR DEHAT","RASULABAD","2019-01-24T17:09:41.273"
"NA","AGRICULTURE","Others","Others","Weather","Information about weather in Sikandra, Kanpur dehat ?
","Kisan bhai aapke shetra mein 25 janvary mein barish ki sambhavna hai .
","UTTAR PRADESH","KANPUR DEHAT","SANDALPUR","2019-01-24T17:12:01.753"
"NA","AGRICULTURE","Others","Others","Weather","Weather in Kanpur Dehat distt............?","Ran fall shoewr in your block in 25 January.","UTTAR PRADESH","KANPUR DEHAT","SANDALPUR","2019-01-24T17:15:17.08"
"NA","AGRICULTURE","Others","Others","Weather","about weather information in kanpur dehat…? 	     ","possibilty of light rain fall in 25 january 2019 in kanpur dehat","UTTAR PRADESH","KANPUR DEHAT","SARBANKHERA","2019-01-24T17:29:28.047"
"NA","AGRICULTURE","Others","Others","Weather","Weather Information in  Jhinjhak ?","
kisan bhai apke yahan 25  january me halki-bunda-bandi hone ki sambhavna hai 

","UTTAR PRADESH","KANPUR DEHAT","JHINJHAK","2019-01-24T17:40:10.5"
"NA","AGRICULTURE","Others","Others","Weather","Asking about weather information of District kanpur dehat...?
","Dear farmer, there is a possibility of rain tomorrow.","UTTAR PRADESH","KANPUR DEHAT","RASULABAD","2019-01-24T17:43:33.693"
"NA","ANIMAL HUSBANDRY","Animal","Goat","Dairy Production","GOVT.SCHEMES INFORMATION. ....?","KISAN BHAI ADHIK JANKARI KE LIYE IS NUMBER PAR SAMPRAK KARE- 05111-220218","UTTAR PRADESH","KANPUR DEHAT","AMRODHA","2019-01-24T17:47:14.577"
"NA","AGRICULTURE","Others","Others","Weather","Weather information in kanpur dehat ..?","Farmer brother, are you likely to receive heavy rain this January 25
","UTTAR PRADESH","KANPUR DEHAT","SARBANKHERA","2019-01-24T17:51:10.377"
"NA","AGRICULTURE","Others","Others","Weather","Weather forecast information of  Derapur.?","There is a possibility of Light rain from January  25  in your area.                                                                        ","UTTAR PRADESH","KANPUR DEHAT","DERAPUR","2019-01-24T17:55:42.663"
"NA","AGRICULTURE","Others","Others","Weather","Asking about weather information of Rasulabad  .......?","Farmer brother, you can have light drizzle here and this week will be clean with light clouds in the weather.
","UTTAR PRADESH","KANPUR DEHAT","RASULABAD","2019-01-24T18:08:12.71"
"NA","AGRICULTURE","Others","Others","Weather","weather information of kanpur dehat...?","kisan bhai aapke shetra me 25 january tak hulki baris ki sambhawna bni hui hai.","UTTAR PRADESH","KANPUR DEHAT","DERAPUR","2019-01-24T18:09:01.787"
"NA","AGRICULTURE","Others","Others","Weather","WEATHER INFORMATION. …..?","KISAN BHAI AP KE YAHA PAR IS SAPTAH 25-26 JANUARY KO BAARISH HONE KI SAMBHAVANA HAI","UTTAR PRADESH","KANPUR DEHAT","RASULABAD","2019-01-24T18:12:11.627"
"NA","AGRICULTURE","Others","Others","Weather","Weather information in Maitha.........?
","Dear farmer, there is a possibility of rain on January 25.
","UTTAR PRADESH","KANPUR DEHAT","MAITHA","2019-01-24T18:14:53.01"
"NA","AGRICULTURE","Others","Others","Weather","Information about weather in Akbarpur, Kanpur dehat ?","Kisan bhai aapke shetra mein 25 janvary mein barish ki sambhavna hai .
","UTTAR PRADESH","KANPUR DEHAT","AKBARPUR","2019-01-24T18:25:24.183"
"NA","AGRICULTURE","Others","Others","Weather","Please tell me Weather  information for Rasulabad in Kanpur dehat district.?   ","kisan bhai aapke yaha 25 January 2019 ko barish aur 26 january 2019 ko bunda -  baandi hone ki sambhavna hai.","UTTAR PRADESH","KANPUR DEHAT","RASULABAD","2019-01-24T18:50:15.273"
"NA","AGRICULTURE","Cereals","Wheat","Weed Management","INFORMATION ABOUT WEED MANAGEMENT IN WHEAT CROP...?","Kisan bhai aap Genhu ki fasal me kharpatwar niyantran hetu Sulfosulfuron 75%  WG @ 13.5 gram dwa prati acre ki dar se lagbhag 150 liter pani me gholkar sprey kare.","UTTAR PRADESH","KANPUR DEHAT","RASULABAD","2019-01-24T19:27:14.94"
"NA","AGRICULTURE","Others","0","Weather","Weather information in Kanpur dehat district…..?
","Kisan bhai apke kshetra me es saptah me kal halki barish aur aage 29 january tak barish ki sambhavna nahi hai.
","UTTAR PRADESH","KANPUR DEHAT","RAJPUR","2019-01-24T19:57:34.527"
"NA","AGRICULTURE","Others","Others","Weather","Weather information About   .sikandra...?","kisan bhai 25 janvary me hlki se tej baarish ki sambhavna hai .
","UTTAR PRADESH","KANPUR DEHAT","SANDALPUR","2019-01-24T19:58:11.593"
"NA","AGRICULTURE","Others","Others","Weather","Information about weather in Malasa, Kanpur dehat ?
","Kisan bhai aapke shetra mein 25 janvary mein barish ki sambhavna hai .
","UTTAR PRADESH","KANPUR DEHAT","MALASA","2019-01-24T20:17:27.743"
"NA","AGRICULTURE","Others","Others","Weather","Weather information in kanpur dehat ..?","You are likely to be weather clean from January 23 to January 28 this week.
","UTTAR PRADESH","KANPUR DEHAT","JHINJHAK","2019-01-24T20:31:42.5"
"NA","AGRICULTURE","Others","Others","Weather","Weather forecast information of  Kanpur Dehat .?","There is a possibility of Light rain from January  25  in your area.                                                                        ","UTTAR PRADESH","KANPUR DEHAT","MAITHA","2019-01-24T20:32:29.19"
"NA","AGRICULTURE","Others","Others","Weather","Tell me about weather information in district Kanpur dehat?
","Farmer brother there is a possibility of cloud and rain this week 25 January.
","UTTAR PRADESH","KANPUR DEHAT","DERAPUR","2019-01-24T20:38:30.523"
"NA","AGRICULTURE","Cereals","Wheat","Fertilizer Use and Availability","Nutrients management in Wheat
","Kisan bhai NPK 19:19:19 @ 2 kg/acre 200 liter paani ke saath chidkaw kare
","UTTAR PRADESH","KANPUR DEHAT","AKBARPUR","2019-01-24T20:42:55.633"
"NA","AGRICULTURE","Others","Others","Weather","Weather information in Maitha.........?
","Dear farmer, there is a possibility of rain on January 25 and 26.
","UTTAR PRADESH","KANPUR DEHAT","MAITHA","2019-01-24T20:43:15.09"
"NA","AGRICULTURE","Others","Others","Weather","Weather Information  in Gajner ?","There is a possibility of rain on 25 January
","UTTAR PRADESH","KANPUR DEHAT","SARBANKHERA","2019-01-24T21:09:47.657"
"NA","AGRICULTURE","Others","Others","Government Schemes","sms sewa lagwana hai ","kisan bhai sms sewa lga di gyi hai ","UTTAR PRADESH","KANPUR DEHAT","AKBARPUR","2019-01-24T21:11:53.957"
"NA","AGRICULTURE","Others","Others","Weather","Weather Information in Malasa  ?","There is a possibility of rain on 24,25 January","UTTAR PRADESH","KANPUR DEHAT","MALASA","2019-01-24T21:46:27.53"
"NA","AGRICULTURE","Others","Others","Government Schemes","Information about Goverment scheme....?","kisan bhai aap krishi yojnayo sambandhit adhik jankari hetu apne block pr sampark kare.","UTTAR PRADESH","KANPUR DEHAT","MALASA","2019-01-24T21:49:46.013"
"NA","AGRICULTURE","Others","Others","Weather","Weather information in Kanpur dehat district ...?","This week, you have the possibility of light rain or drizzle on January 25 and 26, and the next day is likely to be clear from January 27 - 31.","UTTAR PRADESH","KANPUR DEHAT","RASULABAD","2019-01-25T06:25:15.157"
"NA","AGRICULTURE","Others","Others","Weather","Information about weather in  rasulabaad…………...?
","Farmer brother, you have the possibility of rain on 25th January and there is no possibility of rain till January 26-30.","UTTAR PRADESH","KANPUR DEHAT","RASULABAD","2019-01-25T06:32:16.957"
"NA","AGRICULTURE","Others","Others","Weather"," Please give me weather information in district kanpur dehat….?
","Kisan bhai apke yhan  aj (25 )january ko halki barish ki sambhawna hai. 
","UTTAR PRADESH","KANPUR DEHAT","MAITHA","2019-01-25T06:56:54.287"
"NA","AGRICULTURE","Others","Others","Weather","Weather information in Kanpur dehat district ...?","This week, you have the possibility of rain and drizzle on January 25 and 26, and the other day is likely to be clear from Jan 27 - 31.","UTTAR PRADESH","KANPUR DEHAT","SARBANKHERA","2019-01-25T07:01:04.81"
"NA","AGRICULTURE","Others","Others","Cultural Practices","Ganhu ki fasal ko pashuwo se bachane ka upay batye?","Kisan bhai aap 5 Liter mattha + 5-6 Deshi andda+500 Gram Kuta huwa Lahsun + 500 Gram Kuta hua Pyaj+ 500 Gram Balu ko  aapas me mila kar mitti ke bartan 8 se 10 dino tk dhakkar rakh den ,uske baad 20 se 25 liter pani mila kar neem ki tahni se chidkaw kren.","UTTAR PRADESH","KANPUR DEHAT","RASULABAD","2019-01-25T07:05:49.297"
"NA","AGRICULTURE","Others","Others","Weather","Asking about weather information...?
","Dear farmers, there is a possibility of weather Clouds in your area in this week.
","UTTAR PRADESH","KANPUR DEHAT","RASULABAD","2019-01-25T07:23:46.573"
"NA","AGRICULTURE","Others","Others","Weather","Give me weather information in district Kanpur Dehat  ?","Kisan Bhai, there is a possibility of light drizzling here today. There is no possibility of rain till January 30","UTTAR PRADESH","KANPUR DEHAT","RASULABAD","2019-01-25T07:24:31.16"
