"Season","Sector","Category","Crop","QueryType","QueryText","KccAns","StateName","DistrictName","BlockName","CreatedOn"
"NA","HORTICULTURE","Vegetables","Potato","	Plant Protection	","plant protection measure for potato...?","kisan bhai aalu ki fasal me Mancozeb 75 % WP 400 gram /ekad 200 liter pani ki dar se ghol  spray kare
","UTTAR PRADESH","KANPUR DEHAT","SARBANKHERA","2019-01-10T12:01:31.293"
"NA","AGRICULTURE","Cereals","Wheat","Nutrient Management","NPK 19:19:19 spray in wheat crop    ?","kisan bhai Gehu Ki fasal me- NPK 19:19:19 - 1.5 se 2 kilogram/acre 100 liter paani me ghol kar spray kare
","UTTAR PRADESH","KANPUR DEHAT","SARBANKHERA","2019-01-10T12:03:01.84"
"NA","HORTICULTURE","Vegetables","Cauliflower","	Plant Protection	","Plant protection in Cauliflower...?","Dear farmer use to Quinalphos 25% EC 2ml/liter water splash in the field
","UTTAR PRADESH","KANPUR DEHAT","SARBANKHERA","2019-01-10T12:20:20.24"
"NA","AGRICULTURE","Others","Others","Weather","BLANK","BLANK","UTTAR PRADESH","KANPUR DEHAT","SARBANKHERA","2019-01-10T12:27:39.417"
"NA","HORTICULTURE","Vegetables","Potato","	Plant Protection	","plant protection in potato.....?","Carbendazim 12% + Mancozeb 63% WP 2 gram/liter pani ke sath spray kare
","UTTAR PRADESH","KANPUR DEHAT","SARBANKHERA","2019-01-10T12:34:33.62"
"NA","AGRICULTURE","Others","Others","Weather","Asking about weather information in ?
","Farmer, there is no possibility of clean rains till January  15.
","UTTAR PRADESH","KANPUR DEHAT","SARBANKHERA","2019-01-10T12:36:45.943"
"NA","HORTICULTURE","Vegetables","Potato","	Plant Protection	","information about in potato for diseases.and Viruses...?","Dear farmer use to Metalaxyl 8%+ Mancozeb 64% WP 3g/liter water splash in the field
Dear farmer use to Thiomethoxam25% WDG 40g/acre with 200 litre of water splash in the field
","UTTAR PRADESH","KANPUR DEHAT","SARBANKHERA","2019-01-10T12:42:23.44"
"NA","AGRICULTURE","Others","Others","Weather","Give me weather information? 
","kisan bhai aap ke yaha 12 january tak koi barish nhi hai
","UTTAR PRADESH","KANPUR DEHAT","SARBANKHERA","2019-01-10T12:49:03.897"
"NA","AGRICULTURE","Others","Others","Weather","Weather information …? kanpur dehat
","You will be cloudy this week but there is no possibility of rain
","UTTAR PRADESH","KANPUR DEHAT","JHINJHAK","2019-01-10T12:51:43.393"
"NA","HORTICULTURE","Vegetables","Brinjal","	Plant Protection	","Blight control in potato...?","kisan bhai aap aalu me Metalaxyl-8% + Mancozeb-64% WP 2 gm/liter pani me ghol banakar spray kare","UTTAR PRADESH","KANPUR DEHAT","SARBANKHERA","2019-01-10T12:57:08.927"
"NA","AGRICULTURE","Cereals","Wheat","Weed Management","Weed control in wheat crop?
","Kisan bhai ap genhu ki fasal par Sulfosulfuron 75% + Metsulfuron methyl  5% WG @ 16 gram/acre ki dar se 150 litr panee me ghol banakar chhidkaw kare
","UTTAR PRADESH","KANPUR DEHAT","JHINJHAK","2019-01-10T13:05:24"
"NA","HORTICULTURE","Vegetables","Potato","	Plant Protection	","aalu ki patti me kaale dhabbe ban rahe hai ?","carbendazim 12 % + maincozeb 63 % @ 2 graam / liter paani me milaakar spray kare ","UTTAR PRADESH","KANPUR DEHAT","SARBANKHERA","2019-01-10T13:13:21.587"
"NA","AGRICULTURE","Cereals","Wheat","Nutrient Management","Nutrient management in wheat crop?","Farmer brother Spray N:P:K 19:19:19 @ 2 kilogram/acre in 200 litres of water in Wheat crop.","UTTAR PRADESH","KANPUR DEHAT","RASULABAD","2019-01-10T13:56:15.99"
"NA","AGRICULTURE","Others","0","Weather","Tell me about Weather Information of this week at Kanpur Dehat District?
","Kisan bhai 10 se 15 January tak apke shetra me badal chaye rahenge barish hone ki sambhavna nahi hai.
","UTTAR PRADESH","KANPUR DEHAT","RASULABAD","2019-01-10T13:57:32.977"
"NA","AGRICULTURE","Cereals","Wheat","	Plant Protection	","urea   Top dressing in  wheat crop  ?","35-40   kilo urea   8.0 kilo zinc sulphate /acre ka prayog kare  ","UTTAR PRADESH","KANPUR DEHAT","JHINJHAK","2019-01-10T14:23:05.987"
"NA","HORTICULTURE","Fruits","Citrus","Nutrient Management","nutrient difficiency in citrus...?","Kisan bhai aap nibu ke paudhe par micronutrient 3 ml dava prati litar pani ki dar se gholkar spre kare.","UTTAR PRADESH","KANPUR DEHAT","RAJPUR","2019-01-10T14:32:53.553"
"NA","AGRICULTURE","Cereals","Wheat","Fertilizer Use and Availability","GIVE INFORMATION ABOUT FERTILIZER DOSE OF WHEAT CROPS....?
"," Kisan bhai aap gayhu ki fasal me pahli sichai 20-25 dino ke baad Urea 35-40 kilogram aur sagarika Z++ 8-10 kilogram mikakar/acre ki dar se khet me bikhrav kare.
","UTTAR PRADESH","KANPUR DEHAT","RAJPUR","2019-01-10T14:55:47.737"
"NA","AGRICULTURE","Cereals","Wheat","Nutrient Management","INFORMATION ABOUT NUTRIENT MANAGEMENT IN WHEAT CROP....?","Kisan bhai Genhu ki fasal me vradhi avm vikas hetu  Sagarika @ 250 ml lagbhag 150 liter pani me gholkar prati acre ke hisab se sprey kare.","UTTAR PRADESH","KANPUR DEHAT","RAJPUR","2019-01-10T15:01:11.47"
"NA","AGRICULTURE","Others","Others","Weather","gehu me chodi patti khar patwar ke liye ","gehu me chodi patti khar    2-4-D  80% Sodiyam shoalt wp  dose -625  gram  /hecter 500-600 liter pani me ghol kar chidkav kare ","UTTAR PRADESH","KANPUR DEHAT","RASULABAD","2019-01-10T16:36:17.58"
"NA","AGRICULTURE","Cereals","Wheat","	Plant Protection	","Plant protection in wheat crop...?","Kisan bhai aap genhu ki fasal me ?????????????? 20 ??????? ?.??. @ 1 litre prati ecar ki dar se prayog kare.","UTTAR PRADESH","KANPUR DEHAT","SARBANKHERA","2019-01-10T17:07:38.343"
"NA","AGRICULTURE","Others","Others","Weather","WEATHER INFORMATION OF DISTRICT KANPUR ...?
","Kisan Bhai: There is no possibility of rain in your area from 10 January to 15 January.
","UTTAR PRADESH","KANPUR DEHAT","JHINJHAK","2019-01-10T18:07:18.263"
"NA","AGRICULTURE","Cereals","Wheat","Nutrient Management","Fertilizer use in Wheat crop ?","Use to 30-35 kg urea and 8 kg sagarika/ acre in wheat crop.
","UTTAR PRADESH","KANPUR DEHAT","RAJPUR","2019-01-10T18:48:23.183"
"NA","AGRICULTURE","Others","Others","Weather","Asking about weather information of banipara kanpur dehat.......?","Farmer brother, the weather here will be clear with light clouds here this week.   
","UTTAR PRADESH","KANPUR DEHAT","JHINJHAK","2019-01-10T19:50:06.423"
"NA","AGRICULTURE","Cereals","Wheat","Fertilizer Use and Availability","Nutrient management in wheat crop?","Spray N:P:K 19:19:19 @ 2 kilogram/acre in 200 litres of water.","UTTAR PRADESH","KANPUR DEHAT","SARBANKHERA","2019-01-10T20:33:29.937"
"NA","HORTICULTURE","Vegetables","Brinjal","Organic Farming","Alu ki patti par dhabba hai  ?","Metalaxyl-8% + Mancozeb-64% WP 400 gram/acre ka spray kare  ","UTTAR PRADESH","KANPUR DEHAT","SARBANKHERA","2019-01-10T20:46:58.903"
"NA","HORTICULTURE","Vegetables","Potato","	Plant Protection	","leaf spot in potato ..?","spray mancozeb 75% wp @ 400 gm/acre witth 200 liter of water for leaf spot control in potato","UTTAR PRADESH","KANPUR DEHAT","SARBANKHERA","2019-01-10T20:54:40.393"
"NA","AGRICULTURE","Others","Others","Weather","Please give me whether information for Kanpur dehat?","Farmer brother from today till 16th January there is no possibility of rain, the clouds will remain","UTTAR PRADESH","KANPUR DEHAT","JHINJHAK","2019-01-11T07:37:11.337"
"NA","AGRICULTURE","Others","Others","Weather","About weather information of Rasulabad in Kanpur Dehat District?

","Farmer brother,there is no possibility of rain from January 11 to January 16.","UTTAR PRADESH","KANPUR DEHAT","RASULABAD","2019-01-11T07:51:33.03"
"NA","AGRICULTURE","Others","Others","Weather","Please give me weather information for SIKANDRA?","Kisan bhai aj se 15 January tak barish ki koi sambhavna nahi hai ","UTTAR PRADESH","KANPUR DEHAT","RAJPUR","2019-01-11T08:10:14.333"
"NA","AGRICULTURE","Others","Others","Weather","Weather information  in Kanpur Dehat"," es hapte mausam saaf  hai  ","UTTAR PRADESH","KANPUR DEHAT","SARBANKHERA","2019-01-11T09:52:06.207"
"NA","AGRICULTURE","Others","Others","Weather","Asking about Plant growth in Wheat crops ?","Farmers are advised to spray mixed with NPK-19: 19: 19 to 5 g / liter of water in wheat |","UTTAR PRADESH","KANPUR DEHAT","SARBANKHERA","2019-01-11T10:19:28.277"
"NA","HORTICULTURE","Vegetables","Potato","	Plant Protection	","fungus control in the potato crops......?"," Kisan Bhai, you can carbendazim 12% + Mancozeb 63% WP 2 grams / liters of water to dissolve in spray
","UTTAR PRADESH","KANPUR DEHAT","SARBANKHERA","2019-01-11T10:39:02.603"
"NA","HORTICULTURE","Vegetables","Potato","	Plant Protection	","Plant protection in potato....?","Dear farmer use to Cymoxanil 8%+ Mancozeb 64% WP 3g/liter water splash in the field
","UTTAR PRADESH","KANPUR DEHAT","SARBANKHERA","2019-01-11T10:45:50.88"
"NA","HORTICULTURE","Vegetables","Potato","	Plant Protection	","disease problem of potato","Kisan Bhai You can make copper oxychloerid 50% WP 500 g + Streptocycline 6 grams / acre of 150 liters of water and spray it.","UTTAR PRADESH","KANPUR DEHAT","SANDALPUR","2019-01-11T11:23:31.613"
"NA","HORTICULTURE","Vegetables","Potato","	Plant Protection	","fungal information in POTATO crops
","Carbendazim 12% + Mancozeb 63% WP   300-400 gm/acre  +  Imidachloprid 17.8% SL  150-200 liter of  water ","UTTAR PRADESH","KANPUR DEHAT","SARBANKHERA","2019-01-11T11:26:45.107"
"NA","HORTICULTURE","Vegetables","Potato","	Plant Protection	","Weather information  ..?
","kisan bhai aaj se 16 janvary tak hlke badal bane rahege baris ki sambhavana nahi hai.
","UTTAR PRADESH","KANPUR DEHAT","SARBANKHERA","2019-01-11T11:32:45.067"
"NA","AGRICULTURE","Others","Others","Weather","Weather information in Kanpur dehat district ...?","This week you will be able to clear the weather from January 11 to January 16
","UTTAR PRADESH","KANPUR DEHAT","RAJPUR","2019-01-11T11:35:51.317"
"NA","AGRICULTURE","Others","Others","Government Schemes","Krishi yantra subsidy par lena hai? 
","Kisan bhai  www.upagriculture.com par registration karaye.
","UTTAR PRADESH","KANPUR DEHAT","SANDALPUR","2019-01-11T12:09:04.61"
"NA","AGRICULTURE","Others","Others","Weather","Weather information in Kanpur Dehat district  ?
","Farmer brother, there is no possibility of rain from you till today, till 16 January
","UTTAR PRADESH","KANPUR DEHAT","JHINJHAK","2019-01-11T13:06:39.697"
"NA","AGRICULTURE","Cereals","Wheat","Weed Management","weed management of wheat crop
"," Kisan Bhai, you can spray the solution of sulfosulfuran 75% + Methulfuran methyl 5% WG dose 16 gm / acre in 200 liters of water in the wheat.
","UTTAR PRADESH","KANPUR DEHAT","AKBARPUR","2019-01-11T13:41:51.24"
"NA","AGRICULTURE","Others","Others","Weather","Weather information of District-Kanpur dehat.....?
","The farmer's brother here Weather will be clear from 11 January to 16 January .
","UTTAR PRADESH","KANPUR DEHAT","JHINJHAK","2019-01-11T14:08:46.32"
"NA","HORTICULTURE","Fruits","Musk Melon","Cultural Practices","Cultivation of Musk Melon?","Melon species -Sharbati, Hara Madhu, Durgapura Madhu, Arka Rajhans and Arka Jeet.","UTTAR PRADESH","KANPUR DEHAT","RASULABAD","2019-01-11T17:13:54.963"
"NA","AGRICULTURE","0","0","Weather","about weather information of akbarpur in kanpur dehat…? 	","there is no possibility of rainfall till 16 january 2019  of akbarpur in kanpur dehat 	","UTTAR PRADESH","KANPUR DEHAT","AKBARPUR","2019-01-11T18:43:49.1"
"NA","AGRICULTURE","Others","Others","Weather","Asking about weather information of District Kanpur Dehat (Rasulabad)..?
","kisan bhai aapke 11 january se 16 january tak baaris ki koi sambhawna nhi hai.
","UTTAR PRADESH","KANPUR DEHAT","RASULABAD","2019-01-11T19:05:01.457"
"NA","AGRICULTURE","Others","Others","Weather","INFORMATION ABOUT WEATHER .....?","KISAN BHAI APKE KSHETRA ME 16 JANUARY TAK ME KABHI - KABHI HALKE BADAL TO BANEGE LEKIN BARISH KI SAMBHAWANA NAHI HAI .","UTTAR PRADESH","KANPUR DEHAT","JHINJHAK","2019-01-11T19:53:19.627"
"NA","AGRICULTURE","Others","0","Weather","WEATHER INFORMATION OF kanpur dehat?
","kisan bhai aapke block me 16 january tk  barish ki sambhavna nhi hai.
","UTTAR PRADESH","KANPUR DEHAT","AMRODHA","2019-01-11T20:02:28.113"
"NA","AGRICULTURE","Others","Others","Weather","WEATHER INFORMATION OF DISTRICT KANPUR DEHAT ?
","Kisan Bhai from January 12 to January 17, the weather here will be clear, there is no possibility of rain","UTTAR PRADESH","KANPUR DEHAT","SANDALPUR","2019-01-12T07:31:30.197"
"NA","AGRICULTURE","Others","Others","Weather","Weather information in Kanpur dehat district ...?","This week you will be able to clear the weather from January 12 to January 17
","UTTAR PRADESH","KANPUR DEHAT","DERAPUR","2019-01-12T09:10:33.683"
"NA","AGRICULTURE","Cereals","Wheat","Fertilizer Use and Availability","uria spray in wheat crop","kisan bhai ek 15 liter pani me 300 gram uria aur 75 gram zink ka pryog kare","UTTAR PRADESH","KANPUR DEHAT","MAITHA","2019-01-12T09:22:29.923"
"NA","AGRICULTURE","Others","Others","Weather","weather information in Kanpur district ? ","Dear Kisan Bhai This week, there is no possibility of rains from today till 17th January","UTTAR PRADESH","KANPUR DEHAT","DERAPUR","2019-01-12T10:56:45.037"
"NA","AGRICULTURE","Cereals","Triticale","Weed Management","weed control in wheat crop?","kisan bhai ap genhu ke khet me genhu ke mama ke liye Clodinafop Propargyl 15% WP 160 gram/acre aur ap chaudi patti khar-patwar nashi hatu carfentrazone ethyl 40%(NABUD) 20 gram prati acre ki dar se 150 liter paani me ghol bnakar chidkaw kare","UTTAR PRADESH","KANPUR DEHAT","AMRODHA","2019-01-12T12:09:39.307"
"NA","AGRICULTURE","Cereals","Wheat","	Plant Protection	","YELLO LEAF PROBLUM IN WHEAT ?","KISAN BHAI AP 80GM ZINK AUR 200GM UREA/15 LITER PANI ME GHOL BANA KAR SPRAY KARE GAHU KE FASAL ME","UTTAR PRADESH","KANPUR DEHAT","MAITHA","2019-01-12T12:36:17.71"
"NA","AGRICULTURE","Others","Others","Weather","tell me about weather information of Jhinjhak District kanpur dehat ?","Kisan Bhai: There will be no clouds of rain in the weather, from 12 January 2019 to 17 January, 2019.","UTTAR PRADESH","KANPUR DEHAT","JHINJHAK","2019-01-12T12:38:37.987"
"NA","AGRICULTURE","Cereals","Wheat","Weed Management","Weed control in Narrow leaf and broad leaf in  wheat crop...?","kisan bhai gehu ki fasal me sankeri aur chaudi Sulfosulfuron 75% + Metsulfuran Methyl 5% WG 150 liter me paani me ghol kar sprya ","UTTAR PRADESH","KANPUR DEHAT","RAJPUR","2019-01-12T12:45:17.573"
"NA","HORTICULTURE","Vegetables","Capsicum","	Plant Protection	","Fruit Crack Problem in Shimla mirch crop ?","Make a solution of boron 2 liters of water per liter of water and make a spray","UTTAR PRADESH","KANPUR DEHAT","SANDALPUR","2019-01-12T13:46:59.097"
"NA","AGRICULTURE","Others","Others","Weather","Asking about weather information...?
","Dear farmer no possibility of rainfall in this week in your area.
","UTTAR PRADESH","KANPUR DEHAT","MAITHA","2019-01-12T15:25:40.89"
"NA","AGRICULTURE","Others","Others","Weather","about weather information of akbarpu in kanpur dehat…? 	 ","there is no possibility of rainfall till 17 january 2019 of akbarpu in kanpur dehat…","UTTAR PRADESH","KANPUR DEHAT","AKBARPUR","2019-01-12T15:51:00.51"
"NA","AGRICULTURE","Others","Others","Weather","Weather information in Rasulabad?","Weather will remain clean till 17 January","UTTAR PRADESH","KANPUR DEHAT","RASULABAD","2019-01-12T16:17:13.97"
"NA","AGRICULTURE","Oilseeds","Raya (Indian Mustard)","	Plant Protection	","information about irrigation in mustard ...?","If there is no moisture in the fields, then you can do light irrigation.","UTTAR PRADESH","KANPUR DEHAT","JHINJHAK","2019-01-12T18:25:15.263"
"NA","AGRICULTURE","Cereals","Wheat","	Plant Protection	","information for yellow rust control in wheat crop?","kisan bhai aap -35 kilogam  urea  aur sath me 8-10 kilogram mono zink /acre, prayog kare ","UTTAR PRADESH","KANPUR DEHAT","MALASA","2019-01-12T18:33:32.223"
"NA","AGRICULTURE","Others","Others","Weather","Asking about weather information of Banipara.....?","Farmer brother, the weather here will be clear with light clouds here this week.   
","UTTAR PRADESH","KANPUR DEHAT","JHINJHAK","2019-01-12T20:14:41.933"
"NA","AGRICULTURE","Others","Others","Weather","Weather information About   ....?","There is no possibility of rain in the weather from the farmers till 12 to 17 January.
","UTTAR PRADESH","KANPUR DEHAT","JHINJHAK","2019-01-12T20:17:39.527"
"NA","AGRICULTURE","Others","Others","Weather","Information about weather in Akbarpur, Kanpur dehat ?","Kisan bhai aapke shetra mein 12 janvary se 17 janvary mein barish ki sambhavna nahi hai .","UTTAR PRADESH","KANPUR DEHAT","AKBARPUR","2019-01-12T21:46:45.3"
"NA","AGRICULTURE","Others","Others","Weather","Please tell me weather information of Kanpur Dehat …?  ","kisan bhai aap ke yaha aaj se 18 janvary tak barish ki koi sambhavna nhi hai ","UTTAR PRADESH","KANPUR DEHAT","RASULABAD","2019-01-13T06:24:55.56"
"NA","AGRICULTURE","Cereals","Wheat","Weed Management","45 DIN KE UPAR GEHU ME KHARPATWAR","AB KOI DAWA NAHI PADEGI ","UTTAR PRADESH","KANPUR DEHAT","RASULABAD","2019-01-13T06:32:24.677"
"NA","AGRICULTURE","Others","Others","Weather","Weather information in Kanpur dehat district ...?","This week you will be able to clear the weather from January 13 to January 18
","UTTAR PRADESH","KANPUR DEHAT","MAITHA","2019-01-13T06:59:55.247"
"NA","AGRICULTURE","Others","Others","Weather","Information about the weather in  Kanpur dehat district..?
","kisan bhai aaj se 18 janvary  tak mosam saaf rahega baris ki sambhavana nahi hai.
","UTTAR PRADESH","KANPUR DEHAT","MAITHA","2019-01-13T07:02:57.317"
"NA","AGRICULTURE","Others","Others","Weather","WEATHER INFORMATION OF DISTRICT KANPUR DEHAT ?
","Farmers weather ranging in area from today until January 18 will be completely clean and no chance of rain.","UTTAR PRADESH","KANPUR DEHAT","JHINJHAK","2019-01-13T07:20:25.767"
"NA","AGRICULTURE","Others","Others","Weather","Please give me Weather information in Kanpur Dehat….. ?
","  Kisan bhai aapke yaha aaj se 18 janavari  tak barish hone ki sambhavna nahi hai
","UTTAR PRADESH","KANPUR DEHAT","RASULABAD","2019-01-13T09:17:14.97"
"NA","AGRICULTURE","Others","Others","Weather","Weather information of Kanpur Dehat...?","Kisan Bhai, this week, there is no possibility of rain here.","UTTAR PRADESH","KANPUR DEHAT","MALASA","2019-01-13T10:05:50.13"
"NA","AGRICULTURE","Cereals","Wheat","Fertilizer Use and Availability","wheat crop growth information...?","kisan bhai 35 kg urea aur 5 kg zink sulpheat / acre vikher kar dena hai .","UTTAR PRADESH","KANPUR DEHAT","AKBARPUR","2019-01-13T10:06:50.893"
"NA","AGRICULTURE","Cereals","Wheat","Fertilizer Use and Availability","information about wheat ........?","Use 27 kg urea after first irrigation in wheat","UTTAR PRADESH","KANPUR DEHAT","AKBARPUR","2019-01-13T11:21:52.537"
"NA","AGRICULTURE","Cereals","Paddy (Dhan)","Government Schemes","KISAN PANJIKARAN KARANA HAI ?
","KISAN PANJIKARAN www.agriculture.up.nic.in par rajistration kare
","UTTAR PRADESH","KANPUR DEHAT","RASULABAD","2019-01-13T11:39:50.78"
"NA","HORTICULTURE","Fruits","Banana","	Plant Protection	","Insects in Banana ?","Melathian spray 50% EC 2ml medication per liter of water per solution","UTTAR PRADESH","KANPUR DEHAT","DERAPUR","2019-01-13T12:47:49.49"
"NA","AGRICULTURE","Oilseeds","Mustard","	Plant Protection	","MUSTARD FERTILIZER INFORMATION ?","KISAN BHAI AP 35kg UREA/ACOR KE DAR SE BURKAV KARE SARSO KE FASAL ME","UTTAR PRADESH","KANPUR DEHAT","SARBANKHERA","2019-01-13T13:47:07.13"
"NA","AGRICULTURE","Cereals","Wheat","Weed Management","weed management in wheat after use of sulfosulfuron and clodinofop....?","45-50 din ki avastha aur 2 bar khar-patwar nashi rasayan lagane ke pashchat kisan call centre koi bhi dava ki sanstuti nahi karta hai.","UTTAR PRADESH","KANPUR DEHAT","RASULABAD","2019-01-13T14:41:57.757"
"NA","AGRICULTURE","Others","Others","Crop Insurance","crop insorence information...?
","kisan bhai aap up krashi nidesak se sampark kare .","UTTAR PRADESH","KANPUR DEHAT","AMRODHA","2019-01-13T15:00:03.413"
"NA","AGRICULTURE","Cereals","Wheat","Training and Exposure Visits","Second dose of nitrogen in wheat crop?","44 kigra urea avm 10 kigra zink sulphate prti acre ki dar se phli sichayi ke baad prayog kare.
","UTTAR PRADESH","KANPUR DEHAT","RASULABAD","2019-01-13T15:40:10.363"
"NA","AGRICULTURE","Cereals","Wheat","	Plant Protection	","Gehu ki pati pili ho rahi hai ?","10 Gram urea , 5.0 zinc sulphate /litre ka spray kare  ","UTTAR PRADESH","KANPUR DEHAT","MAITHA","2019-01-13T16:03:56.32"
"NA","AGRICULTURE","Cereals","Wheat","	Plant Protection	","information about termite cantrol  in wheat crop","dear farmer spry of chlorpayriphos 20% ec 2 mili per liter in wheat crop ","UTTAR PRADESH","KANPUR DEHAT","DERAPUR","2019-01-13T16:18:10.81"
"NA","AGRICULTURE","Cereals","Wheat","Weed Management","weed management in wheat crop....?","kisan bhai aap Sulfosulfuron 75%+ Metsulfuron methyl 5% WG.16 gram/acre 150 litre pani me gholkar sprey kare.","UTTAR PRADESH","KANPUR DEHAT","SARBANKHERA","2019-01-13T16:49:30.363"
"NA","AGRICULTURE","Others","Others","Weather","Asking about weather information of Rajpur.......?","Farmer brother, the weather here will be clear with light clouds here this week.   
","UTTAR PRADESH","KANPUR DEHAT","RAJPUR","2019-01-13T17:25:12.13"
"NA","AGRICULTURE","Others","Others","Weather","Weather information of District-Kanpur Dehat.....?
","The farmer's brother here Weather will be clear from 13 January to 18 January .
","UTTAR PRADESH","KANPUR DEHAT","RAJPUR","2019-01-13T17:32:07.84"
"NA","AGRICULTURE","Others","Others","Weather","Weather information about kanpur dehat  …?","Kisan bhai 13-18 janbary tak mausam me hlke se baadel  hai bearish ki koi sambhavna nahi hai .","UTTAR PRADESH","KANPUR DEHAT","JHINJHAK","2019-01-13T17:57:53.8"
"NA","HORTICULTURE","Vegetables","Potato","	Plant Protection	","plant protection in potato ..?","spray Metalaxyl 8%+ Mancozeb 64% WP 3gm/liter water
","UTTAR PRADESH","KANPUR DEHAT","JHINJHAK","2019-01-13T18:55:04.8"
"NA","AGRICULTURE","Others","Others","Weather","Please give me whether information for Kanpur dehat?","Farmer brother from today till 18th January there is no possibility of rain.","UTTAR PRADESH","KANPUR DEHAT","MAITHA","2019-01-13T19:33:23.95"
"NA","AGRICULTURE","Others","Others","Weather","weather information of   Gajner ,Kanpur Dehat  ?","kisan bhai aapke yhan 18 january tak barish ki koi sambhawana nhi  hai ","UTTAR PRADESH","KANPUR DEHAT","SARBANKHERA","2019-01-13T20:17:37.137"
"NA","AGRICULTURE","Others","Others","Weather","INFORMATION ABOUT WEATHER...?
","Farmers this week you have no chance of rain from January 14 to January 19.
","UTTAR PRADESH","KANPUR DEHAT","AMRODHA","2019-01-14T07:33:17.387"
"NA","AGRICULTURE","Others","Others","Weather","Please give me weather information for derapur?","Kisan bhai aj se 18 January tak barish ki koi sambhavna nahi hai","UTTAR PRADESH","KANPUR DEHAT","DERAPUR","2019-01-14T08:51:28.497"
"NA","AGRICULTURE","Others","Others","Weather","Please give me Weather information in Kanpur Dehat….. ?
","  Kisan bhai aapke yaha aaj se 19 janavari  tak barish hone ki sambhavna nahi hai
","UTTAR PRADESH","KANPUR DEHAT","JHINJHAK","2019-01-14T09:42:07.68"
"NA","HORTICULTURE","Vegetables","Potato","Cold Storage","TELL ME GIVE RELATED OFFICER CONECT NUMBER  COLD STORAGE RELATED  PROBLEM ?","CONTECT FOR 9452221750","UTTAR PRADESH","KANPUR DEHAT","SANDALPUR","2019-01-14T10:00:57.577"
"NA","AGRICULTURE","Others","Others","Weather","disconnected ","","UTTAR PRADESH","KANPUR DEHAT","SARBANKHERA","2019-01-14T11:16:55.21"
"NA","AGRICULTURE","Others","Others","Weather","Weather information about Knapur Dehat ....?","Dear Farmer This week, there is no possibility of rain from here till 18 January.","UTTAR PRADESH","KANPUR DEHAT","AKBARPUR","2019-01-14T11:33:05.947"
"NA","AGRICULTURE","Others","Others","Weather","WEATHER INFORMATION OF DISTRICT KANPUR DEHAT ?
","Kisan Bhai in your area from 14 January to 19 January the weather will be completely clean and there is no possibility of rain","UTTAR PRADESH","KANPUR DEHAT","SANDALPUR","2019-01-14T11:39:30.463"
"NA","AGRICULTURE","Cereals","Wheat","Fertilizer Use and Availability","fertilizer in wheat crops....?","Farmer brother should use 35 kg of urea and 5 kg of zinc/ acre in wheat crop.","UTTAR PRADESH","KANPUR DEHAT","RASULABAD","2019-01-14T12:29:42.95"
"NA","AGRICULTURE","Others","Others","Government Schemes","Provide information for taking on spray machine grants.","The interested beneficiary farmers can get the benefit of the plan on the first inward first step by registering themselves on Farmer's transparency portal www.upagriculture.com.","UTTAR PRADESH","KANPUR DEHAT","AKBARPUR","2019-01-14T13:57:58.127"
"NA","AGRICULTURE","Cereals","Wheat","Fertilizer Use and Availability","GEHUN ME KAUNSI KHAD DAALE ?","N P K 19 19 19  1.5 KG/ACRE DAALE","UTTAR PRADESH","KANPUR DEHAT","SANDALPUR","2019-01-14T15:08:58.217"
"NA","AGRICULTURE","Others","Others","Weather","Asking about weather information of Jhinjhak.......?","Farmer brother, the weather here will be clear with light clouds here this week.   
","UTTAR PRADESH","KANPUR DEHAT","JHINJHAK","2019-01-14T16:21:59.88"
"NA","AGRICULTURE","Others","Others","Weather","Asking about weather information...?
","Dear farmer no possibility of rainfall in this week in your area.
","UTTAR PRADESH","KANPUR DEHAT","RASULABAD","2019-01-14T16:41:52.193"
"NA","HORTICULTURE","Condiments and Spices","Coriander","Water Management, Micro Irrigation","dhaniya ke sichai ke bare me jankari de....?","dhaniya ki sichai ko nami dekhkar kare  ","UTTAR PRADESH","KANPUR DEHAT","SARBANKHERA","2019-01-14T17:10:46.93"
"NA","AGRICULTURE","Cereals","Wheat","Nutrient Management","Urea dose in wheat after 2md irrigation ?","Kisan bhai aap 35 kg urea /acre ka prayog kare .","UTTAR PRADESH","KANPUR DEHAT","AMRODHA","2019-01-14T17:36:54.053"
