"Season","Sector","Category","Crop","QueryType","QueryText","KccAns","StateName","DistrictName","BlockName","CreatedOn"
"NA","AGRICULTURE","Others","Others","Weather","Please give me weather information for Kanpur dehat?","Farmer brother there is possibility of rain on 22 and 25 january.","UTTAR PRADESH","KANPUR DEHAT","SARBANKHERA","2019-01-20T11:49:35.7"
"NA","AGRICULTURE","Others","Others","Weather","WEATHER INFORMATION OF DISTRICT KANPUR DEHAT ?
","Kisan Bhai Your weather will be clear today and the clouds will remain cloudy from January 21 to January 25 and there is a possibility of rain.","UTTAR PRADESH","KANPUR DEHAT","MAITHA","2019-01-20T11:57:46.953"
"NA","AGRICULTURE","Others","Others","Weather","KANPUR DEHAT KA MAUSAM KI JANKARI BATAYE ","This week, there is a possibility of normal rains in the region of 21,22,23,24 AND 25 january
","UTTAR PRADESH","KANPUR DEHAT","DERAPUR","2019-01-20T12:08:43.46"
"NA","AGRICULTURE","Others","Others","Weather","WEATHER INFORMATION OF DISTRICT KANPUR DEHAT ?
","Kisan Bhai will be clear in your area today and tomorrow and from 22 January to 25 January the clouds will remain cloudy and there is a possibility of rain","UTTAR PRADESH","KANPUR DEHAT","RASULABAD","2019-01-20T12:20:14.553"
"NA","HORTICULTURE","Vegetables","Bitter Gourd","Vegetative Propagation and Tissue Culture","Variety of bitter gourd.....?","Variety of bitter gourd-arka harit,pusa vishesh,pusa do mausami","UTTAR PRADESH","KANPUR DEHAT","AKBARPUR","2019-01-20T12:48:05.497"
"NA","AGRICULTURE","Others","Others","Weather","please give me  Weather information about  Kanpur Dehat ....?","Dear farmers, this week you have the possibility of rain from January 21 to January 25.
","UTTAR PRADESH","KANPUR DEHAT","RASULABAD","2019-01-20T12:49:09.413"
"NA","AGRICULTURE","Cereals","Wheat","Nutrient Management","Nutrient Managment in Wheat crop ?","kisan bhai aap Urea-30 kg/acre,Zink sulphate-5 kg/acre ki dar se prayog kare .","UTTAR PRADESH","KANPUR DEHAT","DERAPUR","2019-01-20T12:50:13.31"
"NA","AGRICULTURE","Others","Others","Cultural Practices","How can i reduced effect of weedicide on crop ?","kisan bhai aap khet ki nirai kare .","UTTAR PRADESH","KANPUR DEHAT","RASULABAD","2019-01-20T13:03:05.79"
"NA","AGRICULTURE","Others","Others","Weather","Please tell me about weather information ?
","kisan ji aap ke yaha Aaj 20 se 26 January tak halke baadal ke sath sath halki barieh ki sambhawana bani hai  .
","UTTAR PRADESH","KANPUR DEHAT","MALASA","2019-01-20T13:17:50.64"
"NA","AGRICULTURE","Others","Others","Weather","Give me about weather information in Kanpur Dehat......?","kisan bhai ap ke yhan 21,25 January ko 3-4mm tak baris hone ki sambhavna hai
","UTTAR PRADESH","KANPUR DEHAT","DERAPUR","2019-01-20T13:38:49.43"
"NA","AGRICULTURE","Others","Others","Weather","plz give me weather information at kanpur dehat?
","Clouds are visible on the 22, 23, 24 and 25 January and there is a possibility of light rain on 22, 23 and 25 January
","UTTAR PRADESH","KANPUR DEHAT","DERAPUR","2019-01-20T13:42:01.407"
"NA","AGRICULTURE","Others","Others","Weather","Weather information of District- kanpur dehat...?","kisan bhai aap ke yahan  20 January me mausam saaf rehega aur 21 se 25 January tak samany barish hone ki sambhawana hai.
","UTTAR PRADESH","KANPUR DEHAT","RASULABAD","2019-01-20T14:06:35.307"
"NA","AGRICULTURE","Others","0","Weather","information of weather in Kanpur Dehat District..?","kisan bhai aapke yaha es saptah 21,22 aur 25 january me barish ki sambhawana hai.","UTTAR PRADESH","KANPUR DEHAT","RAJPUR","2019-01-20T14:13:09.587"
"NA","AGRICULTURE","Others","Others","Weather","weather information in kanpur dehat ....?","21 22 24 25 January is likely to be a light rain.","UTTAR PRADESH","KANPUR DEHAT","RAJPUR","2019-01-20T14:13:21.473"
"NA","AGRICULTURE","Others","Others","Weather","Asking about weather information of District Kanpur Dehat......?
","Kisan bhai aapke yaha 21 se 24 january tak bunda baandi aur 25 january ko 10 mm baaris ki sambhawna bni hui hai.
","UTTAR PRADESH","KANPUR DEHAT","MALASA","2019-01-20T14:19:41.497"
"NA","AGRICULTURE","Cereals","Wheat","Nutrient Management","Information about good time of fertilizer application....?","kisan bhai aap  urea sichai ke baad proyog kare.","UTTAR PRADESH","KANPUR DEHAT","RAJPUR","2019-01-20T14:22:57.687"
"NA","AGRICULTURE","Others","Others","Weather","Weather information of district Kanpur dehat...?","Kisan bhai aapke yha 21 janvary se 25 janvary tak baadal chaye rhenge aur baris ki sambhavna hai.","UTTAR PRADESH","KANPUR DEHAT","SANDALPUR","2019-01-20T15:20:08.25"
"NA","AGRICULTURE","Others","Others","Weather","please give me weather information in gajner kanpur dehat ?
","poore saptah halke badal ke sat 21 se 24 january me halki tatha 25 january me achhi baris hone ka anuman hai
","UTTAR PRADESH","KANPUR DEHAT","SARBANKHERA","2019-01-20T15:24:59.613"
"NA","AGRICULTURE","Others","Others","Weather","weather information of   Banipara ,Kanpur Dehat  ?","kisan bhai aapke yhan 21 - 25 january tak halki barish hone ki sambhawana hai ","UTTAR PRADESH","KANPUR DEHAT","JHINJHAK","2019-01-20T16:24:29.503"
"NA","AGRICULTURE","Others","Others","Weather","Weather information about district- Kanpur dehat……..?","Kisan bhai aapke yaha par 21 se 25 january tak halke baaris hone ki sambhavana hai 
","UTTAR PRADESH","KANPUR DEHAT","SANDALPUR","2019-01-20T16:50:16.38"
"NA","AGRICULTURE","Others","Others","Weather","weather information in kanpur dehat ...?
","21 22 24 25 January is likely to be a light rain.
","UTTAR PRADESH","KANPUR DEHAT","RAJPUR","2019-01-20T16:54:41.083"
"NA","AGRICULTURE","Others","Others","Weather","Information about weather district  kanpur dehat  ...?","Farmer brother, there is a possibility of rain on 21,22,25.
","UTTAR PRADESH","KANPUR DEHAT","JHINJHAK","2019-01-20T17:01:03.73"
"NA","AGRICULTURE","Others","Others","Weather","WEATHER INFORMATION OF DIST. KANPUR DEHAT. …..?","KISAN BHAI AP KE YAHA PAR IS SAPTAH 21-25 JANUARY KO BAARISH HONE KI SAMBHAVANA HAI","UTTAR PRADESH","KANPUR DEHAT","MAITHA","2019-01-20T17:05:31.49"
"NA","AGRICULTURE","Cereals","Wheat","	Plant Protection	","information about plant growth regulator in wheat crop ?","dear farmer spry of sagarika 250 mili disolve iin 150 liter water for per acer in wheat crop ","UTTAR PRADESH","KANPUR DEHAT","AKBARPUR","2019-01-20T17:11:54.76"
"NA","AGRICULTURE","Cereals","Wheat","	Plant Protection	","2 nd irrgation time in wheat ...?","after 40-45 days ","UTTAR PRADESH","KANPUR DEHAT","SARBANKHERA","2019-01-20T17:30:23.86"
"NA","HORTICULTURE","Vegetables","Bhindi(Okra/Ladysfinger)","	Plant Protection	","Weed control in bhindi ..?","Pendimethalin 30% EC @ 3ml/liter paani me mila kar jamao se pehle spray kare
","UTTAR PRADESH","KANPUR DEHAT","SARBANKHERA","2019-01-20T17:59:05.88"
"NA","AGRICULTURE","Others","Others","Weather","Weather information about district- kanpur dehat……..?","Kisan bhai aapke yaha par 21 se 25 january tak halke baaris hone ki sambhavana hai 
","UTTAR PRADESH","KANPUR DEHAT","JHINJHAK","2019-01-20T18:33:31.67"
"NA","AGRICULTURE","Others","0","Weather","weather information of kanpur dehat....?","kisan bhai aapke shetra me 21 se 25 january tak hulki baris ki sambhawna bni hui hai.

","UTTAR PRADESH","KANPUR DEHAT","MALASA","2019-01-20T18:49:26.78"
"NA","AGRICULTURE","Cereals","Wheat","Nutrient Management","YELLOWING PROBLEM IN WHEAT CROP...?","Kisn bhai gehun ki fasal me urea @ 30 kilo gram+zinc sulphate 8 kilo gram+sagarika 8 kilo gram prati acre ki dar se nami me upyog kare.","UTTAR PRADESH","KANPUR DEHAT","MALASA","2019-01-20T18:57:45.3"
"NA","AGRICULTURE","Others","Others","Weather","WEATHER INFORMATION OF DIST. KANPUR DEHAT. …..?","KISAN BHAI AP KE YAHA PAR IS SAPTAH 21-25 JANUARY KO BAARISH HONE KI SAMBHAVANA HAI","UTTAR PRADESH","KANPUR DEHAT","SANDALPUR","2019-01-20T19:26:05.95"
"NA","AGRICULTURE","Others","Others","Weather","weather information in  kanpur dehat district ?","kisan bhai 21, 22 , 25  janvary  ko barish ki sambhawana hai  ","UTTAR PRADESH","KANPUR DEHAT","RASULABAD","2019-01-20T20:26:27.787"
"NA","AGRICULTURE","Others","Others","Weather","INFORMATION ABOUT WEATHER OF KANPUR DEHAT DISTRICT....?","Farmer brother is likely to get showers in your area on 21, 22 and 25 January.","UTTAR PRADESH","KANPUR DEHAT","JHINJHAK","2019-01-20T20:50:49.313"
"NA","AGRICULTURE","Others","Others","Weather","Weather information of Kanpur Dehat.......?","Kisan bhai aapke yaha 21, 22, 25, january ke din 04 se 08 mm barish ki sambhavana hai 
","UTTAR PRADESH","KANPUR DEHAT","MAITHA","2019-01-20T20:57:40.397"
"NA","AGRICULTURE","Others","Others","Weather","weather information of banipara  , kanpur dehat ?","kisan bhai aapke yhan  21 - 25 january tak halki barish hone ki sambhawana hai  ","UTTAR PRADESH","KANPUR DEHAT","JHINJHAK","2019-01-20T21:20:26.607"
"NA","AGRICULTURE","Others","Others","Weather","About weather information of Rasulabad in Kanpur Dehat District?","Farmer brother,will remain cloudy on 21,22,23,24,25 & 26 January and there is a possibility of rain on January 21,22 and 25.

","UTTAR PRADESH","KANPUR DEHAT","RASULABAD","2019-01-21T06:13:41.7"
"NA","AGRICULTURE","Others","Others","Weather","Weather information of Rasulabad, Kanpur Dehat district....?","Farmer Brother, this week you are likely to get showers on 21, 22 and 25 January.","UTTAR PRADESH","KANPUR DEHAT","RASULABAD","2019-01-21T06:25:30.903"
"NA","AGRICULTURE","Others","Others","Weather","Plz, Give me weather information District Kanpur Dehat Block Rasulabad ?","In the field will remain cloudy until January 26, today is likely to rain on 22 and 25 January ,","UTTAR PRADESH","KANPUR DEHAT","RASULABAD","2019-01-21T06:50:23.257"
"NA","AGRICULTURE","Others","Others","Weather","Information about the weather in  district ....?
","kisan bhai 23,24,26 janvary ko hlke badal avm 21,22,25 janvary ko hlki baris hone ki sambhavana hai.
","UTTAR PRADESH","KANPUR DEHAT","RASULABAD","2019-01-21T07:16:05.61"
"NA","AGRICULTURE","Cereals","Wheat","Fertilizer Use and Availability","information about fertilizer in wheat crop ............?","?????? ??? ?????? ?? ??? ?????? ?? ?% ??? ?-? ???? /??? ?? ???? ????? ??? ????? /??? ?? ?? ?? ?????? ??? ","UTTAR PRADESH","KANPUR DEHAT","AKBARPUR","2019-01-21T07:20:08.77"
"NA","AGRICULTURE","Others","Others","Weather","Tell me about Weather Information of this week at Kanpur Dehat District?
","Kisan bhai 21 se 26 January tak apke shetra me badal chaye rahenge,21,22, aur 25 january ko barish hone ki sambhavna hai.
","UTTAR PRADESH","KANPUR DEHAT","AKBARPUR","2019-01-21T07:23:27.673"
"NA","AGRICULTURE","Others","Others","Weather","mausam ki jankari dist kanpur dehat
","kisan bhai ap ke yaha 21aur 25 january ko halki si barish ki sambhawana hai
","UTTAR PRADESH","KANPUR DEHAT","RASULABAD","2019-01-21T08:01:51.58"
"NA","AGRICULTURE","Millets","Maize (Makka)","Sowing Time and Weather","give information about sowing time of maize?","The first week of February is best for sowing of maize. Sowing must be done by February 20. When delayed, the silk and pollen grains are likely to dry due to hot winds when the cumin is released.","UTTAR PRADESH","KANPUR DEHAT","JHINJHAK","2019-01-21T08:22:08.027"
"NA","AGRICULTURE","Others","Others","Weather","Kanpur dehat Zile ki mausam ki jankari bataye
","kisan bhai aap ke yaha 21 january se 25 january tak halki barish hone ki sambhawana bani hai  
","UTTAR PRADESH","KANPUR DEHAT","AMRODHA","2019-01-21T08:24:19.52"
"NA","AGRICULTURE","Others","Others","Weather","Weather information about Kanpur Dehat ?","kisan bhai aapke yaha 21,22 aur 25 Janvary ko barish hone ki sambhavna hai .
","UTTAR PRADESH","KANPUR DEHAT","SARBANKHERA","2019-01-21T08:45:38.603"
"NA","AGRICULTURE","Others","Others","Weather","Plz, Give me weather information District Kanpur Dehat Block Rasulabad ?","In the field will remain cloudy until January 26, today is likely to rain on 22 and 25 January","UTTAR PRADESH","KANPUR DEHAT","RASULABAD","2019-01-21T08:52:44.567"
"NA","AGRICULTURE","Others","Others","Weather","Please give me weather information for block-MAITHA,district-KANPUR DEHAT?","KISAN BHAI 21-22 JANUARY AUR 25-26 JANUARY KO BAARISH KI SAMBHAVANA HAI.
","UTTAR PRADESH","KANPUR DEHAT","MAITHA","2019-01-21T08:55:34.47"
"NA","AGRICULTURE","Oilseeds","Soybean (bhat)","Sowing Time and Weather","sowing time of soybeen..?","you can sow the soybeen from  15 jun to 10 july.","UTTAR PRADESH","KANPUR DEHAT","MAITHA","2019-01-21T08:57:38.85"
"NA","AGRICULTURE","Others","Others","Weather","Please tell me about weather information kanpur dehat?","kisan bhai aap ke block me aj 21 se 26 january tak badaal bne huye hai barish ki sambhawana hai","UTTAR PRADESH","KANPUR DEHAT","SANDALPUR","2019-01-21T09:17:27.84"
"NA","AGRICULTURE","Others","Others","Weather",". plz give me weather information at kanpur dehat?
","The farmer's brother is constantly changing from January 22 to January 26. On January 22, there is light rain and heavy rain on January 25 is there
","UTTAR PRADESH","KANPUR DEHAT","RASULABAD","2019-01-21T09:28:28.28"
"NA","AGRICULTURE","Others","Others","Weather","Asking about weather information in Kanpur Dehat ?
","Today is the possibility of drizzling with the clouds from January 21 to January 26
","UTTAR PRADESH","KANPUR DEHAT","SANDALPUR","2019-01-21T09:30:57.65"
"NA","AGRICULTURE","Others","Others","Weather","WEATHER INFORMSATION IN KANPUR DEHAT ?","KISAN BHAI AP KE YAHA 21,22,23,24,25 KO BARESH HONE KE SAMBHWANA HAI
","UTTAR PRADESH","KANPUR DEHAT","MAITHA","2019-01-21T09:36:00.577"
"NA","AGRICULTURE","Others","Others","Weather","Information about weather in  sikandra…………...?
","You have the possibility of rain on January 21-26
","UTTAR PRADESH","KANPUR DEHAT","RAJPUR","2019-01-21T10:01:51.9"
"NA","AGRICULTURE","Others","Others","Weather","Kisan pangikaran ki jankari....?","Kisan bhai Panjikaran number janane ke liye  block se samparak kare ","UTTAR PRADESH","KANPUR DEHAT","AMRODHA","2019-01-21T10:04:18.137"
"NA","AGRICULTURE","Others","Others","Weather","Please give me weather information for block-SARBANKHERA,district-KANPUR DEHAT?","BHAI 21-22 JANUARY AUR 25-26 JANUARY KO BAARISH KI SAMBHAVANA HAI.
","UTTAR PRADESH","KANPUR DEHAT","SARBANKHERA","2019-01-21T10:04:54.203"
"NA","AGRICULTURE","Others","Others","Weather","Give me about weather information in ......?
","kisan bhai ap ke yhan 21,22,25, 26 January ko 3-5mm tak baris hone ki sambhavna hai
","UTTAR PRADESH","KANPUR DEHAT","MAITHA","2019-01-21T10:16:58.853"
"NA","AGRICULTURE","Others","Others","Weather","weather infermation of  Kanpurdehat.........?","kisan bhai aapke yaha 21,22 aur 25 janwari me barish ki sambhawna hai  
","UTTAR PRADESH","KANPUR DEHAT","DERAPUR","2019-01-21T10:32:19.567"
"NA","AGRICULTURE","Others","Others","Weather"," weather information  inKanpur dehat district ? ","Dear Kisan Bhai This week you have light clouds from today till 26th January and there is a possibility of light drizzle","UTTAR PRADESH","KANPUR DEHAT","RASULABAD","2019-01-21T10:32:43.137"
"NA","AGRICULTURE","Others","Others","Weather","Please tell me about weather information kanpur dehat?","kisan bhai aap ke block me aj 21 se 26 january tak badaal bne huye hai barish ki sambhawana hai","UTTAR PRADESH","KANPUR DEHAT","DERAPUR","2019-01-21T10:36:57.86"
"NA","AGRICULTURE","Cereals","Wheat","	Plant Protection	","informatiom about  disease in wheat..............?","Dear farmer use to  Copper Oxychloride 50% WP  2.5g/liter water splash in the field
","UTTAR PRADESH","KANPUR DEHAT","AMRODHA","2019-01-21T10:41:18.307"
"NA","HORTICULTURE","Fruits","Banana","Cultural Practices","sowing time for banana....?","kisan bhai aap kela ki kheti jun mah me kar sakate hai","UTTAR PRADESH","KANPUR DEHAT","MALASA","2019-01-21T10:43:32.593"
"NA","AGRICULTURE","Cereals","Wheat","Fertilizer Use and Availability","fertilizer dose information in wheat crops","Kisan bhai aap Genhu ki fasal me vradhi avm badhwar hetu - N:P:K- 18:18:18 @ 1- 1.5 kg lagbhag 120 liter pani me gholkar prati acre ke hisab se sprey karvaye.
","UTTAR PRADESH","KANPUR DEHAT","RASULABAD","2019-01-21T10:44:21.14"
"NA","AGRICULTURE","Others","Others","Weather","WEATHER INFORMSATION IN KANPUR DEHAT ?","KISAN BHAI AP KE YAHA 21,24,25 KO BARESH HONE KE SAMBHWANA HAI
","UTTAR PRADESH","KANPUR DEHAT","JHINJHAK","2019-01-21T10:45:27.537"
"NA","AGRICULTURE","Pulses","Bengal Gram (Gram/Chick Pea/Kabuli/Chana)","Fertilizer Use and Availability","Fertilizer use in Gram crop ........?","Urea 15 kilogram ,  Micronutrient 08 kilogram / Acre prayog kare ","UTTAR PRADESH","KANPUR DEHAT","MALASA","2019-01-21T11:04:54.73"
"NA","AGRICULTURE","Others","Others","Government Schemes","Kisan rid mohan ke bare me jankari ?","kisan bhai aap es link par click se sampark kare -www.upkisankarjrahat.upsdc.gov.in","UTTAR PRADESH","KANPUR DEHAT","MALASA","2019-01-21T11:09:04.21"
"NA","AGRICULTURE","Others","Others","	Plant Protection	","Animal problem in Wheat crop ...?","KIsan bhai gehun ki fasal ko  pashu se bachane ke liye Rafuchakkar 05 kilogram / Acre prayog kare ","UTTAR PRADESH","KANPUR DEHAT","MALASA","2019-01-21T11:12:25.063"
"NA","AGRICULTURE","Others","Others","Weather","please give me  Weather information about  Kanpur dehat ...?","Dear farmer brother ,  there is a possibility of heavy rains on January 25 here.","UTTAR PRADESH","KANPUR DEHAT","RASULABAD","2019-01-21T11:14:45.84"
"NA","AGRICULTURE","Others","Others","Weather","weather infermation of  Kanpur dehat.......?","kisan bhai aapke yaha 21,22 aur 25 janwari me barish ki sambhawna hai  
","UTTAR PRADESH","KANPUR DEHAT","JHINJHAK","2019-01-21T11:14:48.57"
"NA","AGRICULTURE","Others","Others","Weather","Weather information in Kanpur dehat district...?
","Kisan bhai apke kshetra me es saptah 22-26 january tak badal bane rah sakte hain aur 21,22,25 january me halki barish ki sambhavna hai.
","UTTAR PRADESH","KANPUR DEHAT","JHINJHAK","2019-01-21T11:16:16.883"
"NA","AGRICULTURE","Others","Others","Weather","Please tell me weather information of Kanpur Dehat…?  
","kisan bhai aap ke yaha 21,22,24,25 aur 26 janvary ko barish hone ki sambhavna hai
","UTTAR PRADESH","KANPUR DEHAT","AKBARPUR","2019-01-21T11:27:28.273"
"NA","AGRICULTURE","Cereals","Wheat","Nutrient Management","N:P:K spray in wheat crop        ?     
","kisan bhai Gehu Ki fasal me- N:P:K 19:19:19 - 1.5 se 2 kilogram/acre 100 liter paani me ghol kar spray kare
","UTTAR PRADESH","KANPUR DEHAT","DERAPUR","2019-01-21T11:32:13.557"
"NA","AGRICULTURE","Others","Others","Weather","kanpur dehat Zile ki mausam ki jankari bataye
","kisan bhai aap ke yaha 21 january se 25 january tak halki barish hone ki sambhawana bani hai  
","UTTAR PRADESH","KANPUR DEHAT","SANDALPUR","2019-01-21T12:01:09.367"
"NA","AGRICULTURE","Others","Others","Weather","Information about weather report in Dist.Kanpur dehat  (Bhognipur)  .......?
","kisaan bhai 21 se 26 january tak aapke yaha halki baarish hone ki sambhavna hai. Badal bane rahenge. 
","UTTAR PRADESH","KANPUR DEHAT","AMRODHA","2019-01-21T12:08:52.57"
"NA","AGRICULTURE","Others","Others","Weather","Give me about weather information in ......?
","kisan bhai ap ke yhan 21,22,25 26 January ko 6-14mm tak baris hone ki sambhavna hai
","UTTAR PRADESH","KANPUR DEHAT","RASULABAD","2019-01-21T12:11:36.403"
"NA","AGRICULTURE","Others","Others","Weather","Information about weather report in Dist. Kanpur Dehat (Derapur)  .......?
","kisaan bhai 21 se 26 january tak aapke yaha halki baarish hone ki sambhavna hai. Badal bane rahenge. 
","UTTAR PRADESH","KANPUR DEHAT","DERAPUR","2019-01-21T13:01:53.857"
"NA","HORTICULTURE","Fruits","Mango","	Plant Protection	","PLANT PROTECTION IN MANGO TREE..?"," KISAN BHAI AAM KE PED MEI Quinalphos 20% EC-2 ML PRATI LITRE PAANI MEI GHOL BANAKAR SPRAY KARE.","UTTAR PRADESH","KANPUR DEHAT","DERAPUR","2019-01-21T13:08:59.743"
"NA","AGRICULTURE","Others","Others","Weather","Please give me Weather information in Kanpur Dehat….. ?
","  Kisan bhai aapke yaha 21,22 aur 25 janavari ko barish hone ki sambhavna hai.
","UTTAR PRADESH","KANPUR DEHAT","MAITHA","2019-01-21T13:19:24.47"
"NA","AGRICULTURE","Others","Others","Weather","Please tell me about weather information kanpur dehat?","kisan bhai aap ke block me aj 21 se 26 january tak badaal bne huye hai sukrawaar ke din bhaari barish ki sambhawana hai","UTTAR PRADESH","KANPUR DEHAT","MALASA","2019-01-21T13:57:36.183"
"NA","AGRICULTURE","Others","Others","Weather","Weather Information in Akbarpur ?","
kisan bhai apke yahan  25 janauray me bhari barish hone ki sambhabna bni hui hai 

","UTTAR PRADESH","KANPUR DEHAT","SARBANKHERA","2019-01-21T14:09:20.737"
"NA","AGRICULTURE","Others","Others","Weather","weather information of    Sikandra ,Kanpur Dehat ?","kisan bhai aapke yhan 21 - 26 january tak halki barish hone ki sambhawana hai ","UTTAR PRADESH","KANPUR DEHAT","SANDALPUR","2019-01-21T14:28:39.987"
"NA","AGRICULTURE","Others","Others","Weather","blank call ?","blank call","UTTAR PRADESH","KANPUR DEHAT","SANDALPUR","2019-01-21T14:35:09.993"
"NA","AGRICULTURE","Others","Others","Weather","Weather information in Kanpur dehat district ...?","This week you have the possibility of rain on 21, 22 and 26 January and there is a possibility of heavy rains on 24 and 25 January.","UTTAR PRADESH","KANPUR DEHAT","JHINJHAK","2019-01-21T14:41:31.903"
"NA","AGRICULTURE","Others","Others","Weather","ASKING ABOUT WEATHER INFORMATION IN KANPUR DEHAT(BLOCK-RAJPUR)","CHANCES OF LIGHT RAIN ON TODAY IN NIGHT","UTTAR PRADESH","KANPUR DEHAT","RAJPUR","2019-01-21T15:01:47.99"
"NA","AGRICULTURE","Others","Others","Weather","WEATHER INFORMATION. …..?","KISAN BHAI AP KE YAHA PAR IS SAPTAH 21-26 JANUARY KO BAARISH HONE KI SAMBHAVANA HAI","UTTAR PRADESH","KANPUR DEHAT","DERAPUR","2019-01-21T15:18:52.1"
"NA","AGRICULTURE","Others","Others","Weather","weather information of zila kanpur dehat ..............","kisan bhai 21 22 , 25 26 junwari  ko barish ki sambhavna hai ","UTTAR PRADESH","KANPUR DEHAT","MALASA","2019-01-21T15:24:03.25"
"NA","AGRICULTURE","Others","Others","Weather","Weather information in Kanpur Dehat......?
","Farmer brother, you have the possibility of rain from 21 to 26 January.
","UTTAR PRADESH","KANPUR DEHAT","MALASA","2019-01-21T15:31:52.007"
"NA","AGRICULTURE","Others","Others","Weather","Weather Information in Rajpur ?","
kisan bhai apke yahan  25 janauray me bhari barish hone ki sambhabna bni hui hai 

","UTTAR PRADESH","KANPUR DEHAT","RAJPUR","2019-01-21T15:42:53.957"
"NA","AGRICULTURE","Pulses","Bengal Gram (Gram/Chick Pea/Kabuli/Chana)","	Plant Protection	","Give information about insect problem of bengal gram ?","Dear farmer use to Triazophos 40% EC 2ml /liter water splash in the field
","UTTAR PRADESH","KANPUR DEHAT","RAJPUR","2019-01-21T15:48:53.527"
"NA","AGRICULTURE","Others","Others","Weather","weather information of maitha ,kanpur dehat ?","kisan bhai aapke yhan 21- 26 january tak halki barish hone ki sambhawana hai ","UTTAR PRADESH","KANPUR DEHAT","MAITHA","2019-01-21T16:02:15.21"
"NA","AGRICULTURE","Others","Others","Weather","Weather information in Kanpur dehat district ...?","This week you have the possibility of rain and drizzle on 21, 22, 24, 25 and 26 January","UTTAR PRADESH","KANPUR DEHAT","RASULABAD","2019-01-21T16:07:36.293"
"NA","AGRICULTURE","Others","Others","Weather","Weather information in Kanpur Dehat distt.....?","Heavy rain fall in your area in 21,22,24 and 25 Januray.","UTTAR PRADESH","KANPUR DEHAT","SANDALPUR","2019-01-21T16:09:05.327"
"NA","AGRICULTURE","Others","Others","Government Schemes","govt.scheme information  ?","www.upkisankarjrahat.upsdc.gov.in","UTTAR PRADESH","KANPUR DEHAT","AKBARPUR","2019-01-21T16:16:31.633"
"NA","AGRICULTURE","Others","Others","Weather","Information about weather condition at derapur block kanpur dehat district ?         
","Dear farmer there will be cloudy weather in your area and possibility of rain at 21,22,26  January 2019
","UTTAR PRADESH","KANPUR DEHAT","DERAPUR","2019-01-21T16:37:03.58"
"NA","AGRICULTURE","Others","Others","Weather","information about weather of kanpur ?","Dear Farmers 21 and 25 in this week, it is possible to have clean weather and clear weather in the remaining days.","UTTAR PRADESH","KANPUR DEHAT","RASULABAD","2019-01-21T16:37:33.14"
"NA","AGRICULTURE","Others","Others","Weather","WEATHER INFORMATION. …..?","KISAN BHAI AP KE YAHA PAR IS SAPTAH 21-26 JANUARY KO BAARISH HONE KI SAMBHAVANA HAI","UTTAR PRADESH","KANPUR DEHAT","SARBANKHERA","2019-01-21T16:57:47.503"
"NA","AGRICULTURE","Others","Others","Weather","Weather Information District kanpur Dehat","You are likely to get light showers from January 21 to 26.","UTTAR PRADESH","KANPUR DEHAT","RASULABAD","2019-01-21T17:13:22.77"
"NA","AGRICULTURE","Others","Others","Weather","Weather information in Kanpur dehat district ...?","This week you have the possibility of rain on 21, 22 and 25 January and the other day is likely to drizzle on 24 and 26
","UTTAR PRADESH","KANPUR DEHAT","SARBANKHERA","2019-01-21T17:13:32.193"
"NA","AGRICULTURE","Others","Others","Weather","Please give me Weather information in rasulabad….. ?","  Kisan bhai aapke yaha 21,22 aur 25 janavari ko barish hone ki sambhavna hai.
","UTTAR PRADESH","KANPUR DEHAT","RASULABAD","2019-01-21T17:18:27.85"
"NA","AGRICULTURE","Others","Others","Weather","weather information of -zila kanpur dehat.........?","kisan bhai 21aur   22  ,25 junwari me barish ki sambhavna hai ","UTTAR PRADESH","KANPUR DEHAT","JHINJHAK","2019-01-21T17:24:59.34"
"NA","AGRICULTURE","Cereals","Wheat","Nutrient Management","plant protection in wheat..?","Dear farmer use to  Mancozeb 75% WP 2g/liter water splash in the field
","UTTAR PRADESH","KANPUR DEHAT","RAJPUR","2019-01-21T17:25:37.48"
